{
  "schema": "approval-request/v1",
  "content_tree": "b2a116485d51a8d25f46854c754cb244281cf24b",
  "commit": {
    "branch": "feature/16-add-lightweight-feature-clarification",
    "parent": "f952dc4d0c1e2ceddfd1c53109b8b7137d306607",
    "base": "f952dc4d0c1e2ceddfd1c53109b8b7137d306607"
  },
  "review": {
    "round": 1,
    "verdict": "PASS",
    "reviewer": "codex (gpt-6-luna)"
  },
  "reasons": [
    ".agents/prompts/reviewer.md: the file defines or carries out the workflow and its gate",
    "scripts/run-feature.sh: the file defines or carries out the workflow and its gate"
  ],
  "explanation": "Issue #16: Add lightweight feature clarification gate before feature planning. The merge of this feature needs the owner's approval for the reasons listed; the approval is the owner's review of the pull request on GitHub, bound to the commit by GitHub. This request asks and records; it grants nothing."
}
