{
  "schema": "approval-request/v1",
  "content_tree": "6117b4cd99520036e79d6452a9342d00166e3cf4",
  "commit": {
    "branch": "feature/204-show-the-reviewer-no",
    "parent": "521a26ca5bbae2608b4a766423aeffc505f04131",
    "base": "521a26ca5bbae2608b4a766423aeffc505f04131"
  },
  "review": {
    "round": 1,
    "verdict": "PASS",
    "reviewer": "codex (gpt-6-luna)"
  },
  "reasons": [
    ".agents/prompts/reviewer.md: the file defines or carries out the workflow and its gate",
    "scripts/review-feature.sh: the file defines or carries out the workflow and its gate"
  ],
  "explanation": "Issue #204: Show the reviewer no change in paths the content fingerprint leaves out, and show the feature's approval request as a claim. The merge of this feature needs the owner's approval for the reasons listed; the approval is the owner's review of the pull request on GitHub, bound to the commit by GitHub. This request asks and records; it grants nothing."
}
