{
  "schema": "approval-request/v1",
  "content_tree": "0c30cbf5af1a1e948b1be046f734431ad9beffc0",
  "commit": {
    "branch": "feature/203-refuse-an-invalid-provider",
    "parent": "521a26ca5bbae2608b4a766423aeffc505f04131",
    "base": "521a26ca5bbae2608b4a766423aeffc505f04131"
  },
  "review": {
    "round": 3,
    "verdict": "PASS",
    "reviewer": "codex (gpt-6-luna)"
  },
  "reasons": [
    "scripts/lib/agent.sh: the file defines or carries out the workflow and its gate",
    "the independent review classified the impact on the architecture as major: The change strengthens validation in shared agent configuration infrastructure used by workflow scripts and doctor.sh. The protected scripts/lib/agent.sh defines behavior multiple workflows rely on, so this affects shared infrastructure while remaining within the stated scope. "
  ],
  "explanation": "Issue #203: Refuse an invalid provider or model on any line of agents.conf, not only the selected one. The merge of this feature needs the owner's approval for the reasons listed; the approval is the owner's review of the pull request on GitHub, bound to the commit by GitHub. This request asks and records; it grants nothing."
}
