{
  "schema": "approval-request/v1",
  "content_tree": "8ef18fd082771e323f5902519de112ef0118389f",
  "commit": {
    "branch": "feature/177-let-codex-write-the",
    "parent": "8d4131db344152cc096e929278c8bc33f70eb9c7",
    "base": "8d4131db344152cc096e929278c8bc33f70eb9c7"
  },
  "review": {
    "round": 5,
    "verdict": "PASS",
    "reviewer": "codex (gpt-6-luna)"
  },
  "reasons": [
    "scripts/lib/agent.sh: the file defines or carries out the workflow and its gate",
    "the independent review classified the impact on the architecture as major: The change alters shared agent-session sandbox permissions in scripts/lib/agent.sh and adds a real Codex sandbox preflight to scripts/doctor.sh. The writable roots are limited to the five runtime directories, and the regression test checks that protected paths remain denied. The previous review’s timeout finding is reflected in the current sleep-based timeout loop and its elapsed-time test. "
  ],
  "explanation": "Issue #177: Let Codex write the runtime files ACT needs under .agents/ without opening the rest of it. The merge of this feature needs the owner's approval for the reasons listed; the approval is the owner's review of the pull request on GitHub, bound to the commit by GitHub. This request asks and records; it grants nothing."
}
