{
  "schema": "approval-request/v1",
  "content_tree": "160580f5d16eb2b699df606b8e89873054cc1857",
  "commit": {
    "branch": "feature/209-ship-level-lines-for",
    "parent": "8085dc3f2a523bac3053726bae1f03fb6cb86055",
    "base": "8085dc3f2a523bac3053726bae1f03fb6cb86055"
  },
  "review": {
    "round": 1,
    "verdict": "PASS",
    "reviewer": "codex (gpt-6-luna)"
  },
  "reasons": [
    ".agents/agents.conf: the file defines or carries out the workflow and its gate"
  ],
  "explanation": "Issue #209: Ship level lines for High risk in agents.conf: fable implements and Codex reviews a High-risk feature. The merge of this feature needs the owner's approval for the reasons listed; the approval is the owner's review of the pull request on GitHub, bound to the commit by GitHub. This request asks and records; it grants nothing."
}
